Technique,Description,Implementation_Complexity,Memory_Efficiency,Retrieval_Speed,Scalability,Use_Cases
Hierarchical Memory Architecture,"Multi-layered memory system (short-term, working, long-term)",High,Excellent,Fast,Excellent,"Enterprise AI assistants, complex conversations"
Semantic Chunking,Content-aware text splitting based on semantic meaning,Medium,Good,Fast,Good,"Document processing, RAG systems"
Vector Database Optimization,Efficient storage and retrieval of high-dimensional embeddings,High,Excellent,Very Fast,Excellent,"Large-scale similarity search, recommendations"
Memory Compression & Consolidation,Compress experiences into dense representations,Medium,Excellent,Medium,Good,Resource-constrained environments
Contextual Memory Retrieval,Retrieve memories based on relevance to current context,Medium,Good,Fast,Good,Personalized AI interactions
Time-Decayed Memory Prioritization,Apply decay functions to prioritize recent/important memories,Low,Good,Fast,Good,Long-running conversations
Graph-Based Memory Networks,Organize information as interconnected knowledge graphs,High,Good,Medium,Excellent,Knowledge management systems
Dynamic Memory Allocation,Adjust memory resources based on conversation complexity,Medium,Excellent,Fast,Excellent,Variable workload applications
Strategic Forgetting,Implement rules for selective memory retention/deletion,Low,Excellent,Fast,Excellent,Privacy-compliant systems
MCP Integration Patterns,Standardized protocol for AI system memory management,Medium,Good,Fast,Excellent,"Multi-agent systems, standardized interfaces"
