Service;Container Name;Port Mapping;Data Storage Type;Volume Mount;Network Dependencies
postgres;postgres;5432:5432;Relational (Agent Registry, Sessions, Config);postgres_data:/var/lib/postgresql/data;Core Hub - All services connect
neo4j;neo4j;7474:7474, 7687:7687;Graph (Knowledge Relationships, Dependencies);neo4j_data:/data, neo4j_logs:/logs;memos.as primary connection
qdrant;qdrant;6333:6333, 6334:6334;Vector (Document Embeddings, Semantic Search);qdrant_data:/qdrant/storage;ingest-llm.as, memos.as primary connections
redis;redis;6379:6379;Cache (Session State, Agent Status, Queues);redis_data:/data;All services for caching
langfuse;langfuse;3000:3000;Observability (LLM Traces, Performance Metrics);langfuse_data:/app/data;All services for tracing
jaeger;jaeger;16686:16686, 14268:14268;Tracing (Request Traces, Service Dependencies);N/A (Ephemeral);All services for distributed tracing
prometheus;prometheus;9090:9090;Metrics (System & Application Metrics);./config/prometheus.yml:/etc/prometheus/prometheus.yml;All services for metrics collection
grafana;grafana;3001:3000;Visualization (Dashboards, Health Monitoring);grafana_data:/var/lib/grafana, ./config/grafana:/etc/grafana/provisioning;prometheus, langfuse for data sources
